{
  "applicant_id": "demo_applicant_1",
  "language": "hi-IN",
  "transcript_native": "मैंने दो साल सिक्योरिटी गार्ड का काम किया है। मैं व्हाइटफील्ड में रहता हूँ, दिन या रात की शिफ्ट कर सकता हूँ और बीस हजार रुपये महीना चाहता हूँ।",
  "transcript_en": "I have worked as a security guard for two years. I live in Whitefield, can work day or night shifts, and expect twenty thousand rupees per month.",
  "captured_at": "2026-08-30T12:20:00+05:30"
}
